{
  "$schema": "http://json-schema.org/draft-07/schema#",
  "$id": "https://schemas.regenesis.dev/brand-brief.schema.json",
  "title": "Brand Brief",
  "type": "object",
  "additionalProperties": false,
  "required": ["brand", "identity", "motion", "contentModel"],
  "properties": {
    "brand": {
      "type": "object",
      "additionalProperties": false,
      "required": ["name", "voice"],
      "properties": {
        "name": { "type": "string", "minLength": 1 },
        "voice": { "type": "string", "enum": ["calm", "energetic", "premium", "playful", "tech"] }
      }
    },
    "identity": {
      "type": "object",
      "additionalProperties": false,
      "required": ["colors", "typography", "density"],
      "properties": {
        "colors": {
          "type": "object",
          "additionalProperties": false,
          "required": ["bg", "fg", "accent", "muted"],
          "properties": {
            "bg": { "type": "string", "minLength": 1 },
            "fg": { "type": "string", "minLength": 1 },
            "accent": { "type": "string", "minLength": 1 },
            "muted": { "type": "string", "minLength": 1 }
          }
        },
        "typography": {
          "type": "object",
          "additionalProperties": false,
          "required": ["display", "text"],
          "properties": {
            "display": {
              "type": "object",
              "additionalProperties": false,
              "required": ["family"],
              "properties": { "family": { "type": "string", "minLength": 1 } }
            },
            "text": {
              "type": "object",
              "additionalProperties": false,
              "required": ["family"],
              "properties": { "family": { "type": "string", "minLength": 1 } }
            }
          }
        },
        "density": { "type": "string", "enum": ["compact", "comfortable", "spacious"] }
      }
    },
    "motion": {
      "type": "object",
      "additionalProperties": false,
      "required": ["personality"],
      "properties": {
        "personality": { "type": "string", "enum": ["subtle", "standard", "expressive"] }
      }
    },
    "contentModel": {
      "type": "array",
      "minItems": 1,
      "items": {
        "type": "object",
        "additionalProperties": false,
        "required": ["intent", "payload"],
        "properties": {
          "intent": {
            "type": "string",
            "enum": ["hero", "feature-grid", "scrollytelling", "testimonial", "cta"]
          },
          "payload": {
            "type": "object",
            "additionalProperties": true
          }
        }
      }
    }
  }
}

